index,url,valid,domain,title,description,image,published,archive,content,quote,language,keyword
https://www.tagesspiegel.de/gesellschaft/panorama/brande-feuerwehren-kampfen-gegen-etliche-waldbrande-15550163.html,https://www.tagesspiegel.de/gesellschaft/panorama/brande-feuerwehren-kampfen-gegen-etliche-waldbrande-15550163.html,0,www.tagesspiegel.de,Brände: Feuerwehren kämpfen gegen etliche Waldbrände,"Trockenheit erschwert den Kampf gegen Waldbrände in Deutschland und Tschechien. Während sich in Brandenburg das Feuer ausbreitet, sind in Tschechien 500 Kräfte in einem Nationalpark im Einsatz.",https://www.tagesspiegel.de/images/15551371/alternates/BASE_16_9_W1400/1777812016000/waldbrand-auf-munitionsbelastetem-gelande-bei-juterbog.jpeg,2026-05-03T08:13:18Z,,"Waldbrände haben am langen Maiwochenende die Feuerwehr in mehreren Bundesländern sowie in Tschechien in Atem gehalten. Erschwert wurden die Löscharbeiten von Trockenheit und mancherorts Wind, so dass… [+3282 chars]",,de,'Waldbrände'
https://www.stern.de/gesellschaft/regional/nordrhein-westfalen/kraeftezehrende-einsaetze--waldbraende-in-nrw--feuerwehr-kaempft-gegen-glutnester-37363718.html,https://www.stern.de/gesellschaft/regional/nordrhein-westfalen/kraeftezehrende-einsaetze--waldbraende-in-nrw--feuerwehr-kaempft-gegen-glutnester-37363718.html,0,www.stern.de,Kräftezehrende Einsätze: Waldbrände in NRW: Feuerwehr kämpft gegen Glutnester,"Attendorn (lnw) - Gleich drei Wald- und Unterholzbrände in Attendorn, Werdohl und Dellbrück haben am langen ersten Mai-Wochenende für große",https://image.stern.de/37363720/t/6_/v1/w1440/r1.7778/-/03--whflowzxm6v1axs2048jpeg---e87e827214b7306a.jpg,2026-05-03T08:46:00Z,,"Kopiere den aktuellen Link
Zur Merkliste hinzufügen
Drohnen, Hubschrauber und Hunderte Einsatzkräfte was die Feuerwehr in NRW beim ersten Waldbrand-Wochenende des Jahres erlebt hat.
Gleich drei Wa… [+2276 chars]",,de,'Waldbrand Wind'
https://www.stern.de/gesellschaft/regional/berlin-brandenburg/alter-truppenuebungsplatz--waldbrand-auf-mehr-als-110-hektar-ausgebreitet-37363926.html,https://www.stern.de/gesellschaft/regional/berlin-brandenburg/alter-truppenuebungsplatz--waldbrand-auf-mehr-als-110-hektar-ausgebreitet-37363926.html,0,www.stern.de,Alter Truppenübungsplatz: Waldbrand auf mehr als 110 Hektar ausgebreitet,Jüterbog (bb) - Der seit Freitag lodernde Waldbrand bei Jüterbog hat sich inzwischen auf mehr als 110 Hektar ausgebreitet. Wegen des kräftigen Windes sei,https://image.stern.de/37363928/t/G4/v1/w1440/r1.7778/-/03--nnrb6myhkyv5axs2048jpeg---7af103711c4d3e9e.jpg,2026-05-03T09:54:21Z,,"Kopiere den aktuellen Link
Zur Merkliste hinzufügen
Auf dem alten Truppenübungsplatz bei Jüterbog brennt es den dritten Tag in Folge. Wind treibt das Feuer an, immer mehr Fläche ist betroffen.
Der… [+794 chars]",,de,'Waldbrand'
https://www.tagesspiegel.de/berlin/alter-truppenubungsplatz-waldbrand-auf-mehr-als-110-hektar-ausgebreitet-15550603.html,https://www.tagesspiegel.de/berlin/alter-truppenubungsplatz-waldbrand-auf-mehr-als-110-hektar-ausgebreitet-15550603.html,0,www.tagesspiegel.de,Alter Truppenübungsplatz: Waldbrand auf mehr als 110 Hektar ausgebreitet,"Auf dem alten Truppenübungsplatz bei Jüterbog brennt es den dritten Tag in Folge. Wind treibt das Feuer an, immer mehr Fläche ist betroffen.",https://www.tagesspiegel.de/images/15550602/alternates/BASE_16_9_W1400/1777802122000/waldbrand-auf-munitionsbelastetem-gelande-bei-juterbog.jpeg,2026-05-03T09:55:23Z,,"Der seit Freitag lodernde Waldbrand bei Jüterbog hat sich inzwischen auf mehr als 110 Hektar ausgebreitet. Wegen des kräftigen Windes sei weiterhin mit einer Ausdehnung des Feuers zu rechnen, sagte A… [+689 chars]",,de,'Waldbrand Wind'
