index,url,valid,domain,title,description,image,published,archive,content,quote,language,keyword
https://www.zeit.de/news/2026-05/01/waldbrand-in-toskana-3-500-menschen-evakuiert,https://www.zeit.de/news/2026-05/01/waldbrand-in-toskana-3-500-menschen-evakuiert,0,www.zeit.de,Feuer in Urlaubsregion: Waldbrand in Toskana: 3.500 Menschen evakuiert,Hier finden Sie Informationen zu dem Thema „Feuer in Urlaubsregion“. Lesen Sie jetzt „Waldbrand in Toskana: 3.500 Menschen evakuiert“.,https://img.zeit.de/news/2026-05/01/waldbrand-in-toskana-3-500-menschen-evakuiert-image-group/wide__1300x731,2026-05-01T08:17:15Z,,Wegen eines großen Waldbrands haben in der Toskana mehr als 3.500 Menschen ihre Häuser verlassen müssen. Das Feuer wütet seit einigen Tagen im Hinterland der italienischen Urlaubsregion zwischen den … [+1145 chars],,de,'Waldbrand'
https://www.zeit.de/news/2026-05/01/160-feuerwehrleute-bei-waldbrand-im-saarland-im-einsatz,https://www.zeit.de/news/2026-05/01/160-feuerwehrleute-bei-waldbrand-im-saarland-im-einsatz,0,www.zeit.de,Feuerwehreinsatz: 160 Feuerwehrleute bei Waldbrand im Saarland im Einsatz,Hier finden Sie Informationen zu dem Thema „Feuerwehreinsatz“. Lesen Sie jetzt „160 Feuerwehrleute bei Waldbrand im Saarland im Einsatz“.,https://img.zeit.de/news/2026-05/01/160-feuerwehrleute-bei-waldbrand-im-saarland-im-einsatz-image-group/wide__1300x731,2026-05-01T09:54:15Z,,Etwa 160 Feuerwehrleute sind bei einem Waldbrand unweit einer Landstraße bei Losheim am See im Einsatz gewesen. Auf einer Fläche von etwa 100 mal 200 Metern brannte am Donnerstagabend trockenes Unter… [+339 chars],,de,'Waldbrand'
https://www.bild.de/news/ausland/3500-menschen-evakuiert-riesiger-waldbrand-wuetet-in-der-toskana-69f498b9a948f97a9e941769,https://www.bild.de/news/ausland/3500-menschen-evakuiert-riesiger-waldbrand-wuetet-in-der-toskana-69f498b9a948f97a9e941769,0,www.bild.de,3500 Menschen evakuiert - Riesiger Waldbrand wütet in der Toskana,"Seit Tagen wütet ein Waldbrand in der Toskana. Mehr als 3.500 Menschen mussten fliehen, 800 Hektar stehen in Flammen.","https://images.bild.de/69f498b9a948f97a9e941769/3e6f2b8d405c8d3056f9af1e1701bbcf,dd3d811d?w=1280",2026-05-01T13:43:05Z,,"TTS-Player überspringenArtikel weiterlesenPisa (Italien)  Seit Tagen lodern die Flammen, ein Ende ist nicht in Sicht. In der Toskana wütet ein gewaltiger Waldbrand zwischen Lucca und Pisa. Rund 800 H… [+1789 chars]",,de,'Waldbrand'
https://orf.at/stories/3428541/,https://orf.at/stories/3428541/,0,orf.at,Waldbrand in Toskana: Tausende mussten Häuser verlassen,,https://orf.at/mojo/1_4_1/storyserver//news/common/images/og-fallback-news.png,2026-05-01T13:53:28Z,,Wegen eines großflächigen Waldbrands haben in der mittelitalienischen Urlaubsregion Toskana heute rund 3.500 Menschen ihre Häuser verlassen müssen. Nach Behördenangaben gingen in den Bergen zwischen … [+697 chars],,de,'Waldbrand'
https://www.tagesschau.de/ausland/europa/italien-toskana-waldbrand-100.html,https://www.tagesschau.de/ausland/europa/italien-toskana-waldbrand-100.html,0,www.tagesschau.de,Tausende Menschen evakuiert - Großflächiger Waldbrand in der Toskana,"Seit Tagen wütet in Mittelitalien ein Feuer, das inzwischen mehrere Quadratkilometer Wald zerstört hat. 3.500 Menschen mussten in Sicherheit gebracht werden. Auslöser war vermutlich ein Feuer auf einem Privatgrundstück.",https://images.tagesschau.de/image/2e8f93c6-a72c-419b-b2ba-7ce9fdffeab6/AAABneN0qPM/AAABnSSvrFg/16x9-big/waldbrand-italien-102.jpg?width=1280,2026-05-01T14:30:38Z,,"Stand: 01.05.2026 16:30 Uhr
Seit Tagen wütet in Mittelitalien ein Feuer, das inzwischen mehrere Quadratkilometer Wald zerstört hat. 3.500 Menschen mussten in Sicherheit gebracht werden. Auslöser war… [+1160 chars]",,de,'Waldbrand Quadratkilometer'
https://www.zeit.de/news/2026-05/01/waldbrand-bei-jueterbog-munition-erschwert-loescheinsatz,https://www.zeit.de/news/2026-05/01/waldbrand-bei-jueterbog-munition-erschwert-loescheinsatz,0,www.zeit.de,Ehemaliger Truppenübungsplatz: Waldbrand bei Jüterbog - Munition erschwert Löscheinsatz,Hier finden Sie Informationen zu dem Thema „Ehemaliger Truppenübungsplatz“. Lesen Sie jetzt „Waldbrand bei Jüterbog - Munition erschwert Löscheinsatz“.,https://img.zeit.de/news/2026-05/01/waldbrand-bei-jueterbog-munition-erschwert-loescheinsatz-image-group/wide__1300x731,2026-05-01T17:39:32Z,,Auf dem ehemaligen Truppenübungsplatz «Altes Lager» bei Jüterbog (Landkreis Teltow-Fläming) ist ein Waldbrand ausgebrochen. Am Nachmittag sei ein ausgedehntes Feuer mit weithin sichtbarer Rauchentwic… [+937 chars],,de,'Waldbrand'
https://www.tagesspiegel.de/berlin/ehemaliger-truppenubungsplatz-waldbrand-bei-juterbog-munition-erschwert-loscheinsatz-15547888.html,https://www.tagesspiegel.de/berlin/ehemaliger-truppenubungsplatz-waldbrand-bei-juterbog-munition-erschwert-loscheinsatz-15547888.html,0,www.tagesspiegel.de,Ehemaliger Truppenübungsplatz: Waldbrand bei Jüterbog - Munition erschwert Löscheinsatz,Auf einem ehemaligen Truppenübungsplatz bei Jüterbog brennt der Wald. Wegen alter Munition können die Einsatzkräfte das Feuer nicht direkt löschen. Rauch ist kilometerweit sichtbar.,https://www.tagesspiegel.de/images/15547887/alternates/BASE_16_9_W1400/1777657272000/waldbrandgefahr-in-brandenburg.jpeg,2026-05-01T17:41:12Z,,Auf dem ehemaligen Truppenübungsplatz Altes Lager bei Jüterbog (Landkreis Teltow-Fläming) ist ein Waldbrand ausgebrochen. Am Nachmittag sei ein ausgedehntes Feuer mit weithin sichtbarer Rauchentwickl… [+987 chars],,de,'Waldbrand'
https://steiermark.orf.at/stories/3352448/,https://steiermark.orf.at/stories/3352448/,0,steiermark.orf.at,Löschteiche in Wäldern geplant,"Waldbrände wie jener, der aktuell in Eisbach-Rein im Bezirk Graz-Umgebung läuft, werden auch in der Steiermark künftig häufiger, befürchten Experten. Um Wälder künftig besser zu schützen, sind etwa Hubschrauber für Nachtflüge sowie die Errichtung von Löschtei…",https://ibs.orf.at/stm?image=https%3A%2F%2Foekastatic.orf.at%2Fmims%2F2026%2F17%2F91%2Fcrops%2Fw%3D1200%2Ch%3D627%2Cq%3D75%2F3015823_master_1166591_waldbrand03.jpg%3Fs%3D7139ea3a2ba7fd6b1e182da38d0072514a7be3fd,2026-05-02T05:30:00Z,,"Das Thema Waldbrand wird ein ständiger Begleiter werden, auch in der grünen Steiermark. Trockene Phasen, wie es sie seit Wochen gibt, werden länger, Feuer häufiger und damit die Einsätze der Hilfsorg… [+1989 chars]",,de,'Waldbrände'
https://www.tagesspiegel.de/berlin/gelande-ist-mit-munition-belastet-waldbrand-auf-altem-truppenubungsplatz-bei-juterbog-dehnt-sich-aus-15548169.html,https://www.tagesspiegel.de/berlin/gelande-ist-mit-munition-belastet-waldbrand-auf-altem-truppenubungsplatz-bei-juterbog-dehnt-sich-aus-15548169.html,0,www.tagesspiegel.de,Gelände ist mit Munition belastet: Waldbrand auf altem Truppenübungsplatz bei Jüterbog dehnt sich aus,26 Hektar brennen jetzt: Ein Feuer auf einem ehemaligen Truppenübungsplatz bei Jüterbog hat sich ausgeweitet. Die Lage ist laut Stadt jedoch unter Kontrolle.,https://www.tagesspiegel.de/images/15548786/alternates/BASE_16_9_W1400/1777720933000/waldbrand-auf-truppenubungsplatz-hat-sich-ausgebreitet.jpeg,2026-05-02T08:04:21Z,,"Der Waldbrand auf einem ehemaligen Truppenübungsplatz in Jüterbog hat sich auf rund 26 Hektar ausgebreitet. Das teilte die Bürgermeisterin der Stadt, Christiane Lindner-Klopsch, der dpa mit. Am Freit… [+1728 chars]",,de,'Waldbrand'
https://www.tagesspiegel.de/berlin/brand-auf-ehemaligem-truppenubungsplatz-feuerwehr-bei-juterbog-im-einsatz-15548169.html,https://www.tagesspiegel.de/berlin/brand-auf-ehemaligem-truppenubungsplatz-feuerwehr-bei-juterbog-im-einsatz-15548169.html,0,www.tagesspiegel.de,Brand auf ehemaligem Truppenübungsplatz: Feuerwehr bei Jüterbog im Einsatz,Nach einem Waldbrand nahe Jüterbog bewertet die Feuerwehr die Lage neu. Alte Munition auf dem Gelände erschwert den Zugang.,https://www.tagesspiegel.de/images/15548168/alternates/BASE_16_9_W1400/1777709061000/feuerwehr-bekampft-brand.jpeg,2026-05-02T08:04:21Z,,"Nach dem Ausbruch eines Waldbrandes in Jüterbog will die Feuerwehr am Vormittag die Lage auf einem kampfmittelbelasteten Gebiet neu bewerten. Am Freitag kam es zu einem Feuer, das nach bisherigen Ang… [+1702 chars]",,de,'Waldbrand'
https://www.stern.de/gesellschaft/regional/rheinland-pfalz-saarland/braende--hunderte-einsatzkraefte-bekaempfen-waldbrand-bei-friesenhagen-37362012.html,https://www.stern.de/gesellschaft/regional/rheinland-pfalz-saarland/braende--hunderte-einsatzkraefte-bekaempfen-waldbrand-bei-friesenhagen-37362012.html,0,www.stern.de,Brände: Hunderte Einsatzkräfte bekämpfen Waldbrand bei Friesenhagen,Rund 350 Feuerwehrleute und weitere Helfer sind nahe Friesenhagen bei einem Waldbrand im Einsatz. Am Morgen laufen gezielte Löscharbeiten in schwierigem Gelände.,https://image.stern.de/37362014/t/lV/v1/w1440/r1.7778/-/02--du72diqytwv25axs2048jpeg---3325697e80374ebe.jpg,2026-05-02T08:40:26Z,,"Kopiere den aktuellen Link
Zur Merkliste hinzufügen
Rund 350 Feuerwehrleute und weitere Helfer sind nahe Friesenhagen bei einem Waldbrand im Einsatz. Am Morgen laufen gezielte Löscharbeiten in schw… [+1621 chars]",,de,'Waldbrand Feuerwehr'
https://www.zeit.de/news/2026-05/02/hunderte-einsatzkraefte-bekaempfen-waldbrand-bei-friesenhagen,https://www.zeit.de/news/2026-05/02/hunderte-einsatzkraefte-bekaempfen-waldbrand-bei-friesenhagen,0,www.zeit.de,Brände: Hunderte Einsatzkräfte bekämpfen Waldbrand bei Friesenhagen,Hier finden Sie Informationen zu dem Thema „Brände“. Lesen Sie jetzt „Hunderte Einsatzkräfte bekämpfen Waldbrand bei Friesenhagen“.,https://img.zeit.de/news/2026-05/02/hunderte-einsatzkraefte-bekaempfen-waldbrand-bei-friesenhagen-image-group/wide__1300x731,2026-05-02T08:40:26Z,,"Ein Waldbrand in unwegsamem und steilem Gelände im Landkreis Altenkirchen hat für einen Großeinsatz der Feuerwehr gesorgt. Wie der Landkreis mitteilte, kämpften hunderte Einsatzkräfte nahe Friesenhag… [+1443 chars]",,de,'Waldbrand'
https://www.stern.de/gesellschaft/regional/berlin-brandenburg/feuer--waldbrand-auf-truppenuebungsplatz-hat-sich-ausgebreitet-37361942.html,https://www.stern.de/gesellschaft/regional/berlin-brandenburg/feuer--waldbrand-auf-truppenuebungsplatz-hat-sich-ausgebreitet-37361942.html,0,www.stern.de,Feuer: Waldbrand auf Truppenübungsplatz hat sich ausgebreitet,Jüterbog (bb) - Der Waldbrand auf einem ehemaligen Truppenübungsplatz bei Jüterbog hat sich ausgeweitet. Das sagte ein Sprecher der Regionalleitstelle.,https://image.stern.de/37362224/t/tL/v1/w1440/r1.7778/-/02--66crh64icav2axs2048jpeg---ec89b6c00b05f6f8.jpg,2026-05-02T10:21:52Z,,"Kopiere den aktuellen Link
Zur Merkliste hinzufügen
Es brennt nach wie vor auf einem ehemaligen Truppenübungsplatz bei Jüterbog. Alte Munition auf dem Gelände erschwert den Zugang.
Der Waldbrand a… [+1336 chars]",,de,'Waldbrand'
https://www.stern.de/gesellschaft/regional/berlin-brandenburg/feuerwehreinsatz--waldbrand-auf-altem-truppenuebungsplatz-dehnt-sich-aus-37362320.html,https://www.stern.de/gesellschaft/regional/berlin-brandenburg/feuerwehreinsatz--waldbrand-auf-altem-truppenuebungsplatz-dehnt-sich-aus-37362320.html,0,www.stern.de,Feuerwehreinsatz: Waldbrand auf altem Truppenübungsplatz dehnt sich aus,Ein Waldbrand auf einem ehemaligen Truppenübungsplatz bei Jüterbog hat sich ausgedehnt. Nicht zum ersten Mal brechen in dem Gebiet Feuer aus - die Lage ist laut Stadt jedoch unter Kontrolle.,https://image.stern.de/37362322/t/fK/v1/w1440/r1.7778/-/02--nnls42ged7v23axs2048jpeg---d3e4001383cd1448.jpg,2026-05-02T11:21:16Z,,"Kopiere den aktuellen Link
Zur Merkliste hinzufügen
Ein Waldbrand auf einem ehemaligen Truppenübungsplatz bei Jüterbog hat sich ausgedehnt. Nicht zum ersten Mal brechen in dem Gebiet Feuer aus - di… [+1318 chars]",,de,'Waldbrand Feuerwehr'
https://www.zeit.de/news/2026-05/02/waldbrand-auf-altem-truppenuebungsplatz-dehnt-sich-aus,https://www.zeit.de/news/2026-05/02/waldbrand-auf-altem-truppenuebungsplatz-dehnt-sich-aus,0,www.zeit.de,Feuerwehreinsatz: Waldbrand auf altem Truppenübungsplatz dehnt sich aus,Hier finden Sie Informationen zu dem Thema „Feuerwehreinsatz“. Lesen Sie jetzt „Waldbrand auf altem Truppenübungsplatz dehnt sich aus“.,https://img.zeit.de/news/2026-05/02/waldbrand-auf-altem-truppenuebungsplatz-dehnt-sich-aus-image-group/wide__1300x731,2026-05-02T11:21:16Z,,"Der Waldbrand auf einem ehemaligen Truppenübungsplatz in Jüterbog hat sich auf rund 26 Hektar ausgebreitet. Das teilte die Bürgermeisterin der Stadt, Christiane Lindner-Klopsch, der dpa mit. Am Freit… [+1111 chars]",,de,'Waldbrand Feuerwehr'
https://www.tagesspiegel.de/berlin/feuerwehreinsatz-feuerwehr-waldbrand-bei-juterbog-konnte-mehrere-tage-dauern-15548787.html,https://www.tagesspiegel.de/berlin/feuerwehreinsatz-feuerwehr-waldbrand-bei-juterbog-konnte-mehrere-tage-dauern-15548787.html,0,www.tagesspiegel.de,Feuerwehreinsatz: Feuerwehr: Waldbrand bei Jüterbog könnte mehrere Tage dauern,"Detonationen am Boden, Rauch am Horizont: Zieht sich der Waldbrand bei Jüterbog über Tage hin? Wegen alter Munition im Boden kann die Feuerwehr dem Feuer oft nur zuschauen.",https://www.tagesspiegel.de/images/15548952/alternates/BASE_16_9_W1400/1777728554000/waldbrand-bei-juterbog.jpeg,2026-05-02T11:22:13Z,,"Die Feuerwehr stellt sich auf eine weitere Ausbreitung des Waldbrandes auf einem ehemaligen Truppenübungsplatz bei Jüterbog im südwestlichen Brandenburg ein. Wir gehen davon aus, dass es sich im schl… [+2233 chars]",,de,'Waldbrand Rauch'
https://www.tagesspiegel.de/berlin/feuerwehreinsatz-bei-juterbog-waldbrand-auf-ehemaligem-truppenubungsplatz-breitet-sich-aus-15548787.html,https://www.tagesspiegel.de/berlin/feuerwehreinsatz-bei-juterbog-waldbrand-auf-ehemaligem-truppenubungsplatz-breitet-sich-aus-15548787.html,0,www.tagesspiegel.de,Feuerwehreinsatz bei Jüterbog: Waldbrand auf ehemaligem Truppenübungsplatz breitet sich aus,"Detonationen am Boden, Rauch am Horizont: Zieht sich der Waldbrand bei Jüterbog über Tage hin? Wegen alter Munition im Boden ist die Brandbekämpfung schwierig.",https://www.tagesspiegel.de/images/15549140/alternates/BASE_16_9_W1400/1777735495000/waldbrand-auf-munitionsbelastetem-gelande-bei-juterbog.jpeg,2026-05-02T11:22:13Z,,"Nach dem Ausbruch eines Waldbrandes auf einem ehemaligen Truppenübungsplatz bei Jüterbog im südwestlichen Brandenburg breitet sich das Feuer aus. Der Waldbrandschutzbeauftragte in Brandenburg, Raimun… [+3368 chars]",,de,'Waldbrand Feuerwehr'
https://www.tagesspiegel.de/berlin/feuerwehreinsatz-waldbrand-auf-altem-truppenubungsplatz-dehnt-sich-aus-15548787.html,https://www.tagesspiegel.de/berlin/feuerwehreinsatz-waldbrand-auf-altem-truppenubungsplatz-dehnt-sich-aus-15548787.html,0,www.tagesspiegel.de,Feuerwehreinsatz: Waldbrand auf altem Truppenübungsplatz dehnt sich aus,Ein Waldbrand auf einem ehemaligen Truppenübungsplatz bei Jüterbog hat sich ausgedehnt. Nicht zum ersten Mal brechen in dem Gebiet Feuer aus - die Lage ist laut Stadt jedoch unter Kontrolle.,https://www.tagesspiegel.de/images/15548786/alternates/BASE_16_9_W1400/1777720933000/waldbrand-auf-truppenubungsplatz-hat-sich-ausgebreitet.jpeg,2026-05-02T11:22:13Z,,"Der Waldbrand auf einem ehemaligen Truppenübungsplatz in Jüterbog hat sich auf rund 26 Hektar ausgebreitet. Das teilte die Bürgermeisterin der Stadt, Christiane Lindner-Klopsch, der dpa mit. Am Freit… [+1159 chars]",,de,'Waldbrand'
https://www.bild.de/regional/brandenburg/bei-jueterbog-waldbrand-suedlich-von-berlin-ausgebrochen-69f5b6106fe2dee7bfb1059e,https://www.bild.de/regional/brandenburg/bei-jueterbog-waldbrand-suedlich-von-berlin-ausgebrochen-69f5b6106fe2dee7bfb1059e,0,www.bild.de,Bei Jüterbog - Großer Waldbrand südlich von Berlin ausgebrochen,Ein Waldbrand auf einem kampfmittelbelasteten Gebiet hält die Feuerwehr in Atem. Am Freitagnachmittag brach das Feuer bei Jüterbog aus.,"https://images.bild.de/69f5b6106fe2dee7bfb1059e/6729e92e325e5d4fc8ca11729c2f273f,d2b2a9d9?w=1280",2026-05-02T11:35:08Z,,TTS-Player überspringenArtikel weiterlesenJüterbog (Brandenburg) Ein Waldbrand in Brandenburg hält die Feuerwehr in Atem. Am Freitagnachmittag brach das Feuer auf dem ehemaligen Truppenübungsplatz Al… [+1818 chars],,de,'Waldbrand'
https://www.stern.de/gesellschaft/regional/nordrhein-westfalen/kraeftezehrende-einsaetze--mai-bringt-erste-waldbraende-in-nrw-37362200.html,https://www.stern.de/gesellschaft/regional/nordrhein-westfalen/kraeftezehrende-einsaetze--mai-bringt-erste-waldbraende-in-nrw-37362200.html,0,www.stern.de,Kräftezehrende Einsätze: Mai bringt erste Waldbrände in NRW,"Attendorn (lnw) - Gleich drei Wald- und Unterholzbrände in Attendorn, Werdohl und Dellbrück haben am langen ersten Mai-Wochenende für große",https://image.stern.de/37362356/t/fJ/v1/w1440/r1.7778/-/02--fpzzmkldpdv1axs2048jpeg---1892989957b2ebd4.jpg,2026-05-02T11:35:56Z,,"Kopiere den aktuellen Link
Zur Merkliste hinzufügen
Drohnen, Hubschrauber und Hunderte Einsatzkräfte was die Feuerwehr in NRW beim ersten Waldbrand-Wochenende des Jahres erlebt hat.
Gleich drei Wa… [+2007 chars]",,de,'Waldbrände'
https://www.stern.de/gesellschaft/regional/berlin-brandenburg/feuerwehreinsatz--feuerwehr--waldbrand-bei-jueterbog-koennte-mehrere-tage-dauern-37362320.html,https://www.stern.de/gesellschaft/regional/berlin-brandenburg/feuerwehreinsatz--feuerwehr--waldbrand-bei-jueterbog-koennte-mehrere-tage-dauern-37362320.html,0,www.stern.de,Feuerwehreinsatz: Feuerwehr: Waldbrand bei Jüterbog könnte mehrere Tage dauern,"Detonationen am Boden, Rauch am Horizont: Zieht sich der Waldbrand bei Jüterbog über Tage hin? Wegen alter Munition im Boden kann die Feuerwehr dem Feuer oft nur zuschauen.",https://image.stern.de/37362578/t/ix/v1/w1440/r1.7778/-/02--w3d2ezhohrv9axs2048jpeg---54aa91c495ff2636.jpg,2026-05-02T13:28:05Z,,"Kopiere den aktuellen Link
Zur Merkliste hinzufügen
Detonationen am Boden, Rauch am Horizont: Zieht sich der Waldbrand bei Jüterbog über Tage hin? Wegen alter Munition im Boden kann die Feuerwehr d… [+2378 chars]",,de,'Waldbrand'
https://www.zeit.de/news/2026-05/02/waldbrand-in-boehmischer-schweiz-hubschrauber-im-einsatz,https://www.zeit.de/news/2026-05/02/waldbrand-in-boehmischer-schweiz-hubschrauber-im-einsatz,0,www.zeit.de,Tschechien: Waldbrand in Böhmischer Schweiz - Hubschrauber im Einsatz,Hier finden Sie Informationen zu dem Thema „Tschechien“. Lesen Sie jetzt „Waldbrand in Böhmischer Schweiz - Hubschrauber im Einsatz“.,https://img.zeit.de/news/2026-05/02/waldbrand-in-boehmischer-schweiz-hubschrauber-im-einsatz-image-group/wide__1300x731,2026-05-02T13:54:55Z,,"Im tschechischen Nationalpark Böhmische Schweiz ist ein Waldbrand ausgebrochen. Betroffen sei eine Fläche von rund zehn Hektar, sagte ein Sprecher der Feuerwehr nach Angaben der Agentur CTK. Demnach … [+1168 chars]",,de,'Waldbrand'
https://www.stern.de/gesellschaft/regional/sachsen/tschechien--waldbrand-in-boehmischer-schweiz---hubschrauber-im-einsatz-37362644.html,https://www.stern.de/gesellschaft/regional/sachsen/tschechien--waldbrand-in-boehmischer-schweiz---hubschrauber-im-einsatz-37362644.html,0,www.stern.de,Tschechien: Waldbrand in Böhmischer Schweiz - Hubschrauber im Einsatz,"Jetrichovice (sn) - Im tschechischen Nationalpark Böhmische Schweiz ist ein Waldbrand ausgebrochen. Betroffen sei eine Fläche von rund zehn Hektar, sagte",https://image.stern.de/37362646/t/jk/v1/w1440/r1.7778/-/02--zpta44hbuwv13axs2048jpeg---fdc45bc557a7f467.jpg,2026-05-02T13:54:55Z,,"Kopiere den aktuellen Link
Zur Merkliste hinzufügen
Rauchschwaden über der Böhmischen Schweiz: Zahlreiche Feuerwehreinheiten und zwei Hubschrauber kämpfen gegen ein Feuer im tschechischen Nationalp… [+1334 chars]",,de,'Waldbrand Hektar'
https://steiermark.orf.at/stories/3352552/,https://steiermark.orf.at/stories/3352552/,0,steiermark.orf.at,Eisbach-Rein: Größter Feuerwehreinsatz,"Rund 2.300 Einsatzkräfte, hunderte Fahrzeuge, Kosten in Millionenhöhe: Der Waldbrand in Eisbach-Rein nördlich von  Graz wird als der bisher größte Feuerwehreinsatz in der Geschichte der Steiermark bezeichnet – und er dauert seit mehr als einer Woche an.",https://ibs.orf.at/stm?image=https%3A%2F%2Foekastatic.orf.at%2Fmojo%2F1_4_1%2Fstoryserver%2Foeka%2Fcommon%2Fimages%2Fog-fallback-stm.png%3Fs%3D34639efb5eb3bfd56044a89259a23cc721f4f603,2026-05-02T15:12:36Z,,"Noch immer lodern Glutnester im Wald. Was von oben ruhig wirkt, ist am Boden ein Kampf gegen die Zeit: Wir seilen die Feuerwehr teilweise in steiles Gelände ab, mit Löschrucksäcken körperlich enorm a… [+1360 chars]",,de,'Waldbrand'
https://www.stern.de/gesellschaft/regional/berlin-brandenburg/feuerwehreinsatz-bei-jueterbog--waldbrand-auf-ehemaligem-truppenuebungsplatz-breitet-sich-aus-37362320.html,https://www.stern.de/gesellschaft/regional/berlin-brandenburg/feuerwehreinsatz-bei-jueterbog--waldbrand-auf-ehemaligem-truppenuebungsplatz-breitet-sich-aus-37362320.html,0,www.stern.de,Feuerwehreinsatz bei Jüterbog: Waldbrand auf ehemaligem Truppenübungsplatz breitet sich aus,"Detonationen am Boden, Rauch am Horizont: Zieht sich der Waldbrand bei Jüterbog über Tage hin? Wegen alter Munition im Boden ist die Brandbekämpfung schwierig.",https://image.stern.de/37362774/t/MM/v1/w1440/r1.7778/-/02--kifyowqqscv2axs2048jpeg---be91fd197c17e86e.jpg,2026-05-02T15:23:53Z,,"Kopiere den aktuellen Link
Zur Merkliste hinzufügen
Detonationen am Boden, Rauch am Horizont: Zieht sich der Waldbrand bei Jüterbog über Tage hin? Wegen alter Munition im Boden ist die Brandbekämpf… [+3492 chars]",,de,'Waldbrand'
https://www.stern.de/gesellschaft/regional/berlin-brandenburg/alter-truppenuebungsplatz--waldbrand-bei-jueterbog-breitet-sich-weiter-aus-37363478.html,https://www.stern.de/gesellschaft/regional/berlin-brandenburg/alter-truppenuebungsplatz--waldbrand-bei-jueterbog-breitet-sich-weiter-aus-37363478.html,0,www.stern.de,Alter Truppenübungsplatz: Waldbrand bei Jüterbog breitet sich weiter aus,Der Waldbrand auf dem ehemaligen Truppenübungsplatz bei Jüterbog wächst weiter. Wegen gefährlicher Kampfmittel muss die Feuerwehr Abstand halten.,https://image.stern.de/37363480/t/wL/v1/w1440/r1.7778/-/03--65kgmwfa76v5axs2048jpeg---1376e5e7e33c6dff.jpg,2026-05-03T06:34:11Z,,"Kopiere den aktuellen Link
Zur Merkliste hinzufügen
Der Waldbrand auf dem ehemaligen Truppenübungsplatz bei Jüterbog wächst weiter. Wegen gefährlicher Kampfmittel muss die Feuerwehr Abstand halten.… [+965 chars]",,de,'Waldbrand Feuerwehr'
https://www.zeit.de/news/2026-05/03/waldbrand-bei-jueterbog-breitet-sich-weiter-aus,https://www.zeit.de/news/2026-05/03/waldbrand-bei-jueterbog-breitet-sich-weiter-aus,0,www.zeit.de,Alter Truppenübungsplatz: Waldbrand bei Jüterbog breitet sich weiter aus,Hier finden Sie Informationen zu dem Thema „Alter Truppenübungsplatz“. Lesen Sie jetzt „Waldbrand bei Jüterbog breitet sich weiter aus“.,https://img.zeit.de/news/2026-05/03/waldbrand-bei-jueterbog-breitet-sich-weiter-aus-image-group/wide__1300x731,2026-05-03T06:34:11Z,,Zwei Tage nach Ausbruch des Feuers dehnt sich der Waldbrand auf einem ehemaligen Truppenübungsplatz bei Jüterbog im südwestlichen Brandenburg weiter aus. Das teilte die Regionalleitstelle am Sonntagm… [+803 chars],,de,'Waldbrand'
https://www.tagesspiegel.de/berlin/alter-truppenubungsplatz-waldbrand-bei-juterbog-breitet-sich-weiter-aus-15549903.html,https://www.tagesspiegel.de/berlin/alter-truppenubungsplatz-waldbrand-bei-juterbog-breitet-sich-weiter-aus-15549903.html,0,www.tagesspiegel.de,Alter Truppenübungsplatz: Waldbrand bei Jüterbog breitet sich weiter aus,Der Waldbrand auf dem ehemaligen Truppenübungsplatz bei Jüterbog wächst weiter. Wegen gefährlicher Kampfmittel muss die Feuerwehr Abstand halten.,https://www.tagesspiegel.de/images/15549902/alternates/BASE_16_9_W1400/1777790140000/waldbrand-auf-munitionsbelastetem-gelande-bei-juterbog.jpeg,2026-05-03T06:35:41Z,,Zwei Tage nach Ausbruch des Feuers dehnt sich der Waldbrand auf einem ehemaligen Truppenübungsplatz bei Jüterbog im südwestlichen Brandenburg weiter aus. Das teilte die Regionalleitstelle am Sonntagm… [+859 chars],,de,'Waldbrand'
https://www.tagesspiegel.de/potsdam/brandenburg/alter-truppenubungsplatz-waldbrand-bei-juterbog-breitet-sich-weiter-aus-15549903.html,https://www.tagesspiegel.de/potsdam/brandenburg/alter-truppenubungsplatz-waldbrand-bei-juterbog-breitet-sich-weiter-aus-15549903.html,0,www.tagesspiegel.de,Waldbrand bei Jüterbog breitet sich aus: Feuerwehr kann wegen gefährlicher Kampfmittel nicht direkt an die Flammen heran,Der am Freitag ausgebrochene Waldbrand auf dem ehemaligen Truppenübungsplatz bei Jüterbog in Brandenburg wächst weiter. Sogenannte Schutzstreifen sollen das Feuer hemmen.,https://www.tagesspiegel.de/images/15549902/alternates/BASE_16_9_W1400/1777790140000/waldbrand-auf-munitionsbelastetem-gelande-bei-juterbog.jpeg,2026-05-03T06:35:41Z,,Zwei Tage nach Ausbruch des Feuers dehnt sich der Waldbrand auf einem ehemaligen Truppenübungsplatz bei Jüterbog im südwestlichen Brandenburg weiter aus. Das teilte die Regionalleitstelle am Sonntagm… [+2506 chars],,de,'Waldbrand Feuerwehr'
