index,url,valid,domain,title,description,image,published,archive,content,quote,language,keyword
https://www.stern.de/news/spaniens-regierungschef-raeumt--unzureichende--praeventionspolitik-vor-waldbraenden-ein-36018940.html,https://www.stern.de/news/spaniens-regierungschef-raeumt--unzureichende--praeventionspolitik-vor-waldbraenden-ein-36018940.html,0,www.stern.de,"Spaniens Regierungschef räumt ""unzureichende"" Präventionspolitik vor Waldbränden ein","Spaniens Ministerpräsident Pedro Sánchez hat angesichts der verheerenden Waldbrände mangelhafte Präventionsmaßnahmen vonseiten der Politik eingeräumt. ""Wir hatten eine eindeutig unzureichende Präventionspolitik"", sagte Sánchez am Montag in Madrid bei der Vors…",https://image.stern.de/36018942/t/DE/v1/w1440/r1.7778/-/01--feuerwehrmann-im-einsatz---6085df059a3fb90e.jpg,2025-09-01T12:32:32Z,https://web.archive.org/web/20250901125243/https://www.stern.de/news/spaniens-regierungschef-raeumt--unzureichende--praeventionspolitik-vor-waldbraenden-ein-36018940.html,"Kopiere den aktuellen Link
Zur Merkliste hinzufügen
Spaniens Ministerpräsident Pedro Sánchez hat angesichts der verheerenden Waldbrände mangelhafte Präventionsmaßnahmen vonseiten der Politik einger… [+1441 chars]",,de,'Waldbrände'
https://orf.at/stories/3404182/,https://orf.at/stories/3404182/,0,orf.at,Waldbrände: Sanchez räumt „unzureichende“ Prävention ein,,https://orf.at/mojo/1_4_1/storyserver//news/common/images/og-fallback-news.png,2025-09-01T12:47:30Z,,Spaniens Ministerpräsident Pedro Sanchez hat angesichts der verheerenden Waldbrände mangelhafte Präventionsmaßnahmen vonseiten der Politik eingeräumt. Wir hatten eine eindeutig unzureichende Präventi… [+1120 chars],,de,'Waldbrände'
https://www.zeit.de/news/2025-09/03/waldbrand-zerstoert-gebaeude-nahe-ehemaliger-goldgraeber-stadt,https://www.zeit.de/news/2025-09/03/waldbrand-zerstoert-gebaeude-nahe-ehemaliger-goldgraeber-stadt,0,www.zeit.de,Kalifornien: Waldbrand zerstört Gebäude nahe ehemaliger Goldgräber-Stadt,Hier finden Sie Informationen zu dem Thema „Kalifornien“. Lesen Sie jetzt „Waldbrand zerstört Gebäude nahe ehemaliger Goldgräber-Stadt“.,https://img.zeit.de/news/2025-09/03/waldbrand-zerstoert-gebaeude-nahe-ehemaliger-goldgraeber-stadt-image-group/wide__1300x731,2025-09-03T07:06:49Z,,Ein sich rasch ausbreitender Waldbrand nahe einer ehemaligen Goldgräber-Stadt im US-Bundesstaat Kalifornien hat Medienberichten zufolge mehrere Häuser und andere Gebäude zerstört. Menschen seien aber… [+1190 chars],,de,'Waldbrand Schaden'
https://www.stern.de/panorama/kalifornien--waldbrand-zerstoert-gebaeude-nahe-ehemaliger-goldgraeber-stadt-36024134.html,https://www.stern.de/panorama/kalifornien--waldbrand-zerstoert-gebaeude-nahe-ehemaliger-goldgraeber-stadt-36024134.html,0,www.stern.de,Kalifornien: Waldbrand zerstört Gebäude nahe ehemaliger Goldgräber-Stadt,San Francisco - Ein sich rasch ausbreitender Waldbrand nahe einer ehemaligen Goldgräber-Stadt im US-Bundesstaat Kalifornien hat Medienberichten zufolge,https://image.stern.de/36024136/t/hB/v1/w1440/r1.7778/-/03--nx53d3nxphv3axs2048jpeg---f7cdf1a4787dbee3.jpg,2025-09-03T07:06:49Z,,"Kopiere den aktuellen Link
Zur Merkliste hinzufügen
Auslöser soll ein Blitz gewesen sein: Östlich von San Francisco breitet sich ein Feuer aus.
Ein sich rasch ausbreitender Waldbrand nahe einer eh… [+1297 chars]",,de,'Waldbrand Gebäude'
https://www.tagesspiegel.de/gesellschaft/panorama/kalifornien-waldbrand-zerstort-gebaude-nahe-ehemaliger-goldgraber-stadt-14267432.html,https://www.tagesspiegel.de/gesellschaft/panorama/kalifornien-waldbrand-zerstort-gebaude-nahe-ehemaliger-goldgraber-stadt-14267432.html,0,www.tagesspiegel.de,Kalifornien: Waldbrand zerstört Gebäude nahe ehemaliger Goldgräber-Stadt,Auslöser soll ein Blitz gewesen sein: Östlich von San Francisco breitet sich ein Feuer aus.,https://www.tagesspiegel.de/images/14267429/alternates/BASE_16_9_W1400/1756883282000/brande-in-kalifornien.jpeg,2025-09-03T07:08:03Z,,Ein sich rasch ausbreitender Waldbrand nahe einer ehemaligen Goldgräber-Stadt im US-Bundesstaat Kalifornien hat Medienberichten zufolge mehrere Häuser und andere Gebäude zerstört. Menschen seien aber… [+1246 chars],,de,'Waldbrand Gebäude'
https://www.n-tv.de/panorama/Waldbrand-nahe-San-Francisco-ausgebrochen-article26006418.html,https://www.n-tv.de/panorama/Waldbrand-nahe-San-Francisco-ausgebrochen-article26006418.html,0,www.n-tv.de,Blitzschlag als Ursache: Waldbrand nahe San Francisco ausgebrochen,"Heftige Waldbrände wüten zu Jahresbeginn vor Los Angeles. Jetzt bricht ein neues Feuer aus, dieses Mal in der Umgebung San Franciscos. Noch ist der Brand nicht allzu groß, doch die Flammen verschlingen bereits Häuser und bedrohen die ehemalige Goldgräberstadt…",https://www.n-tv.de/img/incoming/crop26006370/3211322139-cImg_16_9-w1200/AP25246125886351.jpg,2025-09-03T09:53:33Z,,"Heftige Waldbrände wüten zu Jahresbeginn vor Los Angeles. Jetzt bricht ein neues Feuer aus, dieses Mal in der Umgebung San Franciscos. Noch ist der Brand nicht allzu groß, doch die Flammen verschling… [+1464 chars]",,de,'Waldbrände'
https://www.nzz.ch/video/europa-in-flammen-warum-es-2025-so-heftig-brennt-und-was-schuetzt-ld.1900813,https://www.nzz.ch/video/europa-in-flammen-warum-es-2025-so-heftig-brennt-und-was-schuetzt-ld.1900813,0,www.nzz.ch,VIDEO - Europa in Flammen: Warum es 2025 so heftig brennt – und was schützt,"Europa erlebt immer öfter Wetterbedingungen, die Waldbrände begünstigen. 2017 und 2022 waren Rekordjahre in der EU. 2025 wird allen Prognosen nach diese Rekorde brechen.","https://img.nzz.ch/2025/09/03/d5acca52-6dad-4ddf-9da0-2cb97b6fca74.jpg?width=1200&height=675&fit=bounds&quality=75&auto=webp&crop=1920,1080,x0,y0&wmark=nzz",2025-09-03T14:52:35Z,,"Europa erlebt immer öfter Wetterbedingungen, die Waldbrände begünstigen. 2017 und 2022 waren Rekordjahre in der EU. Fast eine Million Hektaren Vegetationsfläche verbrannte 2025 wird allen Prognosen n… [+3286 chars]",,de,'Waldbrände'
https://www.tagesspiegel.de/wissen/waldbrande-in-spanien-und-portugal-klimawandel-macht-extremfeuer-40-mal-wahrscheinlicher-14268062.html,https://www.tagesspiegel.de/wissen/waldbrande-in-spanien-und-portugal-klimawandel-macht-extremfeuer-40-mal-wahrscheinlicher-14268062.html,0,www.tagesspiegel.de,Waldbrände in Spanien und Portugal: Klimawandel macht Extremfeuer 40-mal wahrscheinlicher,"Die Waldbrandsaison hat Spanien und Portugal in diesem Jahr beispiellos getroffen: Über eine Million Hektar Land verbrannten, Hunderttausende Menschen mussten evakuiert werden. Forschende warnen, dass der Klimawandel solche Extremfeuer wahrscheinlicher macht …",https://www.tagesspiegel.de/images/14268152/alternates/BASE_16_9_W1400/1756905090000/waldbrande-in-spanien.jpeg,2025-09-03T16:36:31Z,https://web.archive.org/web/20250904054109/https://www.tagesspiegel.de/wissen/waldbrande-in-spanien-und-portugal-klimawandel-macht-extremfeuer-40-mal-wahrscheinlicher-14268062.html,Die Waldbrandsaison 2025 hat Spanien und Portugal schwer getroffen und gehört zu den verheerendsten seit Beginn der Aufzeichnungen. Bis Ende August wurden in Spanien mehr als 380.000 Hektar zerstört … [+972 chars],,de,'Waldbrände Klimawandel'
https://www.stern.de/news/studie--risiko-von-hitzewellen-wie-zuletzt-in-spanien-durch-klimawandel-vervierzigfacht-36028090.html,https://www.stern.de/news/studie--risiko-von-hitzewellen-wie-zuletzt-in-spanien-durch-klimawandel-vervierzigfacht-36028090.html,0,www.stern.de,Studie: Risiko von Hitzewellen wie zuletzt in Spanien durch Klimawandel vervierzigfacht,Der menschengemachte Klimawandel sorgt laut einer Studie für eine Vervierzigfachung des Risikos für Hitzewellen mit schweren Waldbränden wie jüngst in Spanien und Portugal. Die internationale Forschungsgruppe World Weather Attribution (WWA) verwies in ihrer M…,https://image.stern.de/36028092/t/4N/v1/w1440/r1.7778/-/04--waldbrandbekaempfung-im-august-in-nordwestspanien---63dd1669a7f478e8.jpg,2025-09-04T10:11:13Z,,"Kopiere den aktuellen Link
Zur Merkliste hinzufügen
Der menschengemachte Klimawandel sorgt laut einer Studie für eine Vervierzigfachung des Risikos für Hitzewellen mit schweren Waldbränden wie jüng… [+2580 chars]",,de,'Waldbrände'
https://www.diepresse.com/20061306/studie-risiko-von-hitzewellen-mit-schweren-waldbraenden-durch-klimawandel-vervierzigfacht,https://www.diepresse.com/20061306/studie-risiko-von-hitzewellen-mit-schweren-waldbraenden-durch-klimawandel-vervierzigfacht,0,www.diepresse.com,Studie: Risiko von Hitzewellen mit schweren Waldbränden durch Klimawandel vervierzigfacht,"Der Klimawandel mache Hitzewellen, die zu intensiven Waldbränden wie heuer in Portugal und Spanien führen, etwa 40 Mal wahrscheinlicher und 30 Prozent intensiver, sagen Forscher.",https://img.diepresse.com/public/incoming/mg7knv-EUROPE-WEATHERSPAIN-WILDFIRE/alternates/DPR_SOCIAL_NACHRICHTEN/EUROPE-WEATHERSPAIN-WILDFIRE,2025-09-04T10:41:16Z,,"Der Klimawandel mache Hitzewellen, die zu intensiven Waldbränden wie heuer in Portugal und Spanien führen, etwa 40 Mal wahrscheinlicher und 30 Prozent intensiver, sagen Forscher.
Der menschengemacht… [+2893 chars]",,de,'Waldbrände Klimawandel'
https://www.sueddeutsche.de/projekte/artikel/wissen/waldbraende-klimawandel-feuerwetter-e940022/,https://www.sueddeutsche.de/projekte/artikel/wissen/waldbraende-klimawandel-feuerwetter-e940022/,0,www.sueddeutsche.de,"Umwelt: Es brennt dort, wo es keine Waldbrände geben sollte","Waldbrände nehmen global zu, auch in Regionen, wo sie bislang selten waren. Der Klimawandel macht die Brände immer unberechenbarer.","https://www.sueddeutsche.de/projekte/artikel/wissen/waldbraende-klimawandel-feuerwetter-e940022/283c6b0949b11e701d01cdcbed5f0303c2f1c7e4b9c4164bb9de134a32301bd0_w2400_h1256_r9,0,3556,1861_q70.jpg",2025-09-04T13:43:00Z,,"Hat ein neues Zeitalter der Waldbrände begonnen? Seit einigen Jahren treten an unterschiedlichsten Orten der Welt Feuer extremen Ausmaßes auf. Das Tückische an diesen „Megabränden“ ist, dass kein Mus… [+130 chars]",,de,'Waldbrände Klimawandel'
https://www.n-tv.de/wissen/Hitze-und-Waldbraende-sind-kuenftig-40-Mal-wahrscheinlicher-article26010479.html,https://www.n-tv.de/wissen/Hitze-und-Waldbraende-sind-kuenftig-40-Mal-wahrscheinlicher-article26010479.html,0,www.n-tv.de,Studie zum Klimawandel: Hitze und Waldbrände: Künftig 40 Mal wahrscheinlicher,"In Deutschland fällt der Sommer selten heiß aus, ganz anders in Südeuropa: Infolge extremer Trockenheit und über 40 Grad brennen Hunderttausende Hektar Fläche. 1100 Menschen könnten dem zum Opfer gefallen sein. Laut einer Studie treten solche Ereignisse künft…",https://www.n-tv.de/img/incoming/crop26010647/318132535-cImg_16_9-w1200/epi-1000099910-REUTERSFOTO-RC2F6GABXVY7-Waldbrand-in-Abejera.jpg,2025-09-04T14:11:27Z,,"In Deutschland fällt der Sommer selten heiß aus, ganz anders in Südeuropa: Infolge extremer Trockenheit und über 40 Grad brennen Hunderttausende Hektar Fläche. 1100 Menschen könnten dem zum Opfer gef… [+2804 chars]",,de,'Waldbrand Hitze'
https://www.zeit.de/wissen/umwelt/2025-09/hitze-klimawandel-waldbraende-studie,https://www.zeit.de/wissen/umwelt/2025-09/hitze-klimawandel-waldbraende-studie,0,www.zeit.de,Hitze und Feuer: Klimawandel macht Waldbrände laut Studie vierzig Mal wahrscheinlicher,Eine Studie zeigt: Das Risiko für Waldbrände wie zuletzt in Spanien ist durch den Klimawandel rasant gewachsen. Auch nimmt die Intensität von Hitzewellen zu.,https://img.zeit.de/wissen/umwelt/2025-09/klimawandel-studie-vervierzigfachung-risiko-hitzewellen/wide__1300x731,2025-09-04T14:26:23Z,,"Der menschengemachte Klimawandel sorgt für ein vierzigfach erhöhtes Risikos für Hitzewellen und Waldbrände im Vergleich zu früheren, normalen Klimabedingungen. Das geht aus einer Studie der internati… [+1539 chars]",,de,'Waldbrände'
https://taz.de/Folgen-der-Klimakrise/!6111968/,https://taz.de/Folgen-der-Klimakrise/!6111968/,0,taz.de,Folgen der Klimakrise: Deutlich erhöhte Gefahr von Waldbränden in Europa,Ohne Klimawandel wären Waldbrände wie dieses Jahr in Spanien und Portugal nur alle 2.5000 Jahre wahrscheinlich – mit sind sie es alle 13 Jahre.,https://taz.de/picture/7912292/1200/39111000-1.jpeg,2025-09-04T14:44:00Z,,Ohne Klimawandel wären Waldbrände wie dieses Jahr in Spanien und Portugal nur alle 2.5000 Jahre wahrscheinlich – mit sind sie es alle 13 Jahre. mehr...,,de,'Waldbrände'
https://www.faz.net/aktuell/gesellschaft/ungluecke/nach-eaton-fire-usa-verklagen-energieversorger-auf-40-millionen-dollar-accg-110672149.html,https://www.faz.net/aktuell/gesellschaft/ungluecke/nach-eaton-fire-usa-verklagen-energieversorger-auf-40-millionen-dollar-accg-110672149.html,0,www.faz.net,„Defekt“ an Stromleitung: USA verklagen Energieversorger nach Waldbrand,Nachdem verheerenden Eaton Fire in Kalifornien mit 19 Toten sollen die Verursacher zahlen. Die amerikanische Regierung fordert 40 Millionen Dollar Schadenersatz von dem Energieversorger Edison.,https://media0.faz.net/ppmedia/w1200/aktuell/feuilleton/3391824230/1.10672166/facebook_teaser/ein-wohnhaus-brennt-waehrend.jpg.webp,2025-09-05T10:29:00Z,,"Acht Monate nach dem Flächenbrand in Altadena nördlich von Los Angeles, bei dem mindestens 19 Menschen ums Leben kamen und mehr als 9000 Gebäude zerstört wurden, hat die amerikanische Regierung eine … [+1354 chars]",,de,'Waldbrand'
https://www.sueddeutsche.de/projekte/artikel/gesellschaft/sz-weekender-lesegeschichten-e442525/,https://www.sueddeutsche.de/projekte/artikel/gesellschaft/sz-weekender-lesegeschichten-e442525/,0,www.sueddeutsche.de,SZ Weekender: Feuerwetter und die richtige Balance,"Hat ein neues Zeitalter der Waldbrände begonnen? Von der Kunst, auf den eigenen Händen zu stehen. Der Musiker David Byrne im Interview. Und mehr. Geschichten für das Wochenende.","https://www.sueddeutsche.de/projekte/artikel/gesellschaft/sz-weekender-lesegeschichten-e442525/a248eaa6d2463b322da4c5e983fc35bb27f1dcab3d9a4542daa2e16119c46a30_w2400_h1256_r38,0,1920,1005_q70.jpg",2025-09-05T12:40:00Z,,"Was passiert, wenn man Buddha am Buffet trifft?
Diese und noch größere Fragen, beantwortet von David Byrne, einst Chef der Talking Heads, jetzt solo brillant.",,de,'Waldbrände'
https://www.focus.de/panorama/autofahrer-faehrt-mitten-in-waldbrand-in-kanada-und-filmt-sich-dabei_0d99bb88-29af-492f-a9f5-6a4e872a0bc0.html,https://www.focus.de/panorama/autofahrer-faehrt-mitten-in-waldbrand-in-kanada-und-filmt-sich-dabei_0d99bb88-29af-492f-a9f5-6a4e872a0bc0.html,0,www.focus.de,Autofahrer fährt mitten in Waldbrand in Kanada und filmt sich dabei,"Auf der Coquihalla-Autobahn in British Columbia bedrohte eine Feuerwand den Verkehr. Es ist zu sehen, wie ein Autofahrer direkt auf den Waldbrand zusteuert.",https://quadro.burda-forward.de/ctf/0560d599-a8e9-442e-88d8-dc6369aa4a34.c5252355-1f5c-4b0e-9d8d-5a3dc086c956.jpeg?im=RegionOfInterestCrop%3D%281200%2C630%29%2CregionOfInterest%3D%28579%2C116%29&hash=7273b82ba0bfdb354d8050101c9a23f97dc9c0413e91392dac8c91fe3907fb2a,2025-09-05T13:02:57Z,,Eine Feuerwand auf der Autobahn und ein Autofahrer steuert direkt darauf zu. Die beklemmende Aufnahme wurde auf der Coquihalla-Autobahn in British Columbia gemacht und am Donnerstag auf X geteilt. In… [+932 chars],,de,'Waldbrand'
https://orf.at/stories/3404482/,https://orf.at/stories/3404482/,0,orf.at,Waldbrände als politischer Spielball,Die Waldbrände in Spanien haben dieses Jahr eine noch nie da gewesene Spur der Zerstörung hinterlassen. Die Suche nach der Verantwortung wird zunehmend zum politischen Spielball. Gegenseitige Schuldzuweisungen zwischen der sozialdemokratischen Zentralregierun…,https://ibs.orf.at/news?image=https%3A%2F%2Fassets.orf.at%2Fmims%2F2025%2F36%2F40%2Fcrops%2Fw%3D1200%2Ch%3D630%2Cq%3D75%2F2755102_master_1061640_spanien_waldbraende_demonstration_leon_ap.jpg%3Fs%3De13538be829c3035676eb0a0b4e8798f6bcbe2c3,2025-09-06T05:45:31Z,,"In Spanien sind seit Jahresbeginn mehr als 400.000 Hektar niedergebrannt. Die Regionen Galicien, Kastilien und Leon sowie Extremadura waren am stärksten betroffen. Zeitweise wüteten Dutzende Brände g… [+4871 chars]",,de,'Waldbrand Hitze'
https://noe.orf.at/stories/3320656/,https://noe.orf.at/stories/3320656/,0,noe.orf.at,Feuerwehr zeigte Können bei Leistungsschau,Rund 100.000 Feuerwehrmitglieder gibt es in Niederösterreich. Zuletzt kämpften heimische Trupps gegen Waldbrände in Südeuropa. Bei der Leistungsschau „KAT25“ in Tulln wurden sie  offiziell gewürdigt. Für die Besucher gab es Einblick in die Arbeit der Feuerweh…,https://ibs.orf.at/noe?image=https%3A%2F%2Foekastatic.orf.at%2Fmims%2F2025%2F36%2F55%2Fcrops%2Fw%3D1200%2Ch%3D627%2Cq%3D75%2F2757716_master_1062855_6b36bcd7-8895-49f0-8ca6-bbec0e7b1826.jpg%3Fs%3D7cb463c396509624400114b07984b24fe9c219e9,2025-09-06T17:47:00Z,,"Ob am Boden, in der Luft oder unter Wasser hautnah den Einsatz der Feuerwehr mitzuerleben, bleibt im Ernstfall ausschließlich den Profis vorbehalten. Bei der großen Leistungsschau in Tulln durften Be… [+2571 chars]",,de,'Waldbrände'
https://www.zeit.de/gesellschaft/zeitgeschehen/2025-09/spanien-portugal-waldbraende-effis-klimawandel,https://www.zeit.de/gesellschaft/zeitgeschehen/2025-09/spanien-portugal-waldbraende-effis-klimawandel,0,www.zeit.de,Trockenheit: Waldbrände in Spanien und Portugal flammen wieder auf,"Erst vor einer Woche hat Spanien seinen Notstand beendet, nun brennt es im Nordwesten wieder. In Portugal sind Hunderte Feuerwehrleute im Einsatz.",https://img.zeit.de/gesellschaft/zeitgeschehen/2025-09/waldbrand-spanien-portugal-einsatz/wide__1300x731,2025-09-07T02:06:54Z,,"In Portugal und Spanien sind erneut Waldbrände aufgeflammt. Im portugiesischen Seia wurden mehrere Straßen geschlossen, 600 Feuerwehrleute sind im Einsatz. Laut den Behörden war ein Feuer wegen stark… [+876 chars]",,de,'Waldbrände'
https://orf.at/stories/3404718/,https://orf.at/stories/3404718/,0,orf.at,Erneut Waldbrände in Portugal und Spanien,,https://orf.at/mojo/1_4_1/storyserver//news/common/images/og-fallback-news.png,2025-09-07T06:12:44Z,,"Auf der Iberischen Halbinsel sind erneut Waldbrände ausgebrochen. In Seia im Zentrum Portugals seien 600 Feuerwehrleute im Einsatz gegen die Flammen, erklärten die portugiesischen Behörden gestern.
… [+1091 chars]",,de,'Waldbrände Klimawandel'
https://www.n-tv.de/panorama/Waldbraende-in-Portugal-und-Spanien-brechen-erneut-aus-article26015785.html,https://www.n-tv.de/panorama/Waldbraende-in-Portugal-und-Spanien-brechen-erneut-aus-article26015785.html,0,www.n-tv.de,Festnahme nach Brandstiftung: Waldbrände in Portugal und Spanien brechen erneut aus,"Starke Winde treiben die Feuer auf der Iberischen Halbinsel an. Nachdem sich die Lage in Spanien zuletzt etwas beruhigt hatte, riegeln die Behörden ein Dorf im Nordwesten ab. Mindestens acht Menschen sind in Portugal und Spanien bei Bränden in diesem Jahr sch…",https://www.n-tv.de/img/incoming/crop26015792/1711323973-cImg_16_9-w1200/542151347.jpg,2025-09-07T07:27:20Z,,"Starke Winde treiben die Feuer auf der Iberischen Halbinsel an. Nachdem sich die Lage in Spanien zuletzt etwas beruhigt hatte, riegeln die Behörden ein Dorf im Nordwesten ab. Mindestens acht Menschen… [+1445 chars]",,de,'Waldbrände'
https://www.bild.de/news/ausland/vaestervik-kanufahrerin-entfacht-waldbrand-durch-unachtsamkeit-68beb52e9f5e0532c1d36cf9,https://www.bild.de/news/ausland/vaestervik-kanufahrerin-entfacht-waldbrand-durch-unachtsamkeit-68beb52e9f5e0532c1d36cf9,0,www.bild.de,Schwedin angeklagt - Pinkel-Pause endet in Waldbrand,"Eine junge Frau verursachte in Västervik einen Waldbrand, indem sie Toilettenpapier anzündete. Der Brand konnte schnell gelöscht werden.","https://images.bild.de/68beb52e9f5e0532c1d36cf9/475bf2a5f7325bc4e7cdaf69ed6790e0,95c495a3?w=1280",2025-09-08T12:06:58Z,,"Eine junge Frau muss sich demnächst vor dem Amtsgericht in Västervik (Schweden) verantworten, weil sie ungewollt einen Waldbrand ausgelöst hatte. Die junge Frau war Anfang Juli mit einem Freund auf K… [+1635 chars]",,de,'Waldbrand'
https://www.stern.de/reise/waldbrand-oder-erdbeben--wie-sie-ans-geld-kommen--wenn-urlaub-ausfaellt-36036768.html,https://www.stern.de/reise/waldbrand-oder-erdbeben--wie-sie-ans-geld-kommen--wenn-urlaub-ausfaellt-36036768.html,0,www.stern.de,"Naturkatatstrophen: Wie Sie an Ihr Geld kommen, wenn der Urlaub ausfällt","Waldbrand, Erdbeben, Vulkanausbruch: Immer wieder gefährden Naturkatastrophen den Urlaub. Reiserechtler Ernst Führich sagt, wie Sie Ihr Geld im Krisenfall zurückbekommen.",https://image.stern.de/36036894/t/d1/v5/w1440/r1.7778/-/urlaub-waldbrand-strand.jpg,2025-09-09T07:06:00Z,,"Zugang zu stern+statt 11,96 
 nur 1  
<ul><li>Alles von stern+ mit erstklassigen Inhalten von GEO und Capital</li><li>4 Wochen testen, dann 2,99  je Woche</li><li>jederzeit kündbar</li></ul>",,de,'Waldbrand'
https://www.stern.de/news/vergangener-monat-war-weltweit-der-drittwaermste-august-seit-aufzeichnungsbeginn-36040282.html,https://www.stern.de/news/vergangener-monat-war-weltweit-der-drittwaermste-august-seit-aufzeichnungsbeginn-36040282.html,0,www.stern.de,Vergangener Monat war weltweit der drittwärmste August seit Aufzeichnungsbeginn,"Verheerende Waldbrände und schweißtreibende Hitzewellen: Der vergangene Monat war weltweit der drittwärmste August seit Beginn der Aufzeichnungen. Die globale Durchschnittstemperatur habe 1,29 Grad über dem vorindustriellen Niveau gelegen, teilte am Dienstag …",https://image.stern.de/36040284/t/Sh/v1/w1440/r1.7778/-/09--suche-nach-abkuehlung-im-august-in-wien---be0fbc57c9ac881b.jpg,2025-09-09T09:57:43Z,,"Kopiere den aktuellen Link
Zur Merkliste hinzufügen
Verheerende Waldbrände und schweißtreibende Hitzewellen: Der vergangene Monat war weltweit der drittwärmste August seit Beginn der Aufzeichnungen… [+1729 chars]",,de,'Waldbrände'
https://www.zeit.de/news/2025-09/09/waldbrand-bedroht-riesenmammutbaeume-in-kalifornien,https://www.zeit.de/news/2025-09/09/waldbrand-bedroht-riesenmammutbaeume-in-kalifornien,0,www.zeit.de,Feuer in den USA: Waldbrand bedroht Riesenmammutbäume in Kalifornien,Hier finden Sie Informationen zu dem Thema „Feuer in den USA“. Lesen Sie jetzt „Waldbrand bedroht Riesenmammutbäume in Kalifornien“.,https://img.zeit.de/news/2025-09/09/waldbrand-bedroht-riesenmammutbaeume-in-kalifornien-image-group/wide__1300x731,2025-09-09T10:59:32Z,,Ein Waldbrand im US-Bundesstaat Kalifornien bedroht mehr als 2.000 Jahre alte Riesenmammutbäume. Das bereits im August ausgebrochene «Garnet Fire» erreichte am Montag (Ortszeit) das Waldgebiet McKinl… [+1963 chars],,de,'Waldbrand'
https://www.stern.de/panorama/feuer-in-den-usa--waldbrand-bedroht-riesenmammutbaeume-in-kalifornien-36040536.html,https://www.stern.de/panorama/feuer-in-den-usa--waldbrand-bedroht-riesenmammutbaeume-in-kalifornien-36040536.html,0,www.stern.de,Feuer in den USA: Waldbrand bedroht Riesenmammutbäume in Kalifornien,"Das ""Garnet Fire"" bedroht im kalifornischen McKinley Grove über 2.000 Jahre alte Riesenmammutbäume. Wie Feuerwehr und Parkverwaltung versuchen, die seltenen Bäume zu schützen.",https://image.stern.de/36040538/t/DB/v1/w1440/r1.7778/-/09--gwbpxfvfzbv7axs2048jpeg---58ea80d877cb1788.jpg,2025-09-09T10:59:32Z,,"Kopiere den aktuellen Link
Zur Merkliste hinzufügen
Das ""Garnet Fire"" bedroht im kalifornischen McKinley Grove über 2.000 Jahre alte Riesenmammutbäume. Wie Feuerwehr und Parkverwaltung versuchen, d… [+2155 chars]",,de,'Waldbrand'
https://www.tagesspiegel.de/gesellschaft/panorama/feuer-in-den-usa-waldbrand-bedroht-riesenmammutbaume-in-kalifornien-14299286.html,https://www.tagesspiegel.de/gesellschaft/panorama/feuer-in-den-usa-waldbrand-bedroht-riesenmammutbaume-in-kalifornien-14299286.html,0,www.tagesspiegel.de,Feuer in den USA: Waldbrand bedroht Riesenmammutbäume in Kalifornien,"Das „Garnet Fire“ bedroht im kalifornischen McKinley Grove über 2.000 Jahre alte Riesenmammutbäume. Wie Feuerwehr und Parkverwaltung versuchen, die seltenen Bäume zu schützen.",https://www.tagesspiegel.de/images/14299283/alternates/BASE_16_9_W1400/1757415639000/waldbrand-in-kalifornien.jpeg,2025-09-09T11:00:40Z,,Ein Waldbrand im US-Bundesstaat Kalifornien bedroht mehr als 2.000 Jahre alte Riesenmammutbäume. Das bereits im August ausgebrochene Garnet Fire erreichte am Montag (Ortszeit) das Waldgebiet McKinley… [+2017 chars],,de,'Waldbrand'
https://orf.at/stories/3404952/,https://orf.at/stories/3404952/,0,orf.at,Waldbrand bedroht Riesenmammutbäume in Kalifornien,,https://orf.at/mojo/1_4_1/storyserver//news/common/images/og-fallback-news.png,2025-09-09T11:30:25Z,,Ein Waldbrand im US-Bundesstaat Kalifornien bedroht aktuell mehr als 2.000 Jahre alte Riesenmammutbäume. Das bereits im August ausgebrochene Garnet Fire erreichte gestern (Ortszeit) das Waldgebiet Mc… [+1192 chars],,de,'Waldbrand'
https://www.spektrum.de/news/usa-waldbrand-bedroht-riesenmammutbaeume-in-kalifornien/2286060,https://www.spektrum.de/news/usa-waldbrand-bedroht-riesenmammutbaeume-in-kalifornien/2286060,0,www.spektrum.de,Feuer in den USA: Waldbrand bedroht Riesenmammutbäume in Kalifornien,"Das »Garnet Fire« bedroht im kalifornischen McKinley Grove über 2000 Jahre alte Riesenmammutbäume. Wie Feuerwehr und Parkverwaltung versuchen, die seltenen Bäume zu schützen.",https://static.spektrum.de/fm/912/f1920x1080/Riesenmammutbaum-iStock-654785496_4kodiak.jpg,2025-09-09T11:39:55Z,,"Dieser Inhalt wurde automatisch von der Deutschen Presse-Agentur (dpa) übernommen und von Spektrum.de nicht redaktionell bearbeitet.
Ein Waldbrand im US-Bundesstaat Kalifornien bedroht mehr als 2000… [+1233 chars]",,de,'Waldbrand'
